[
  {
    "hotel_id": "CT-HT-001",
    "name": "Le Marais Grand Hotel",
    "city": "Paris",
    "country": "France",
    "star_rating": "5",
    "price_per_night_usd": "320.00",
    "amenities": "WiFi,Pool,Spa,Restaurant,Gym",
    "available_rooms": "8",
    "check_in_date": "2025-08-15",
    "check_out_date": "2025-08-30"
  },
  {
    "hotel_id": "CT-HT-002",
    "name": "Montmartre Budget Inn",
    "city": "Paris",
    "country": "France",
    "star_rating": "3",
    "price_per_night_usd": "95.00",
    "amenities": "WiFi,Breakfast",
    "available_rooms": "22",
    "check_in_date": "2025-08-15",
    "check_out_date": "2025-08-30"
  },
  {
    "hotel_id": "CT-HT-003",
    "name": "Seine River Suites",
    "city": "Paris",
    "country": "France",
    "star_rating": "4",
    "price_per_night_usd": "210.00",
    "amenities": "WiFi,Restaurant,Gym,River View",
    "available_rooms": "14",
    "check_in_date": "2025-08-15",
    "check_out_date": "2025-08-30"
  },
  {
    "hotel_id": "CT-HT-004",
    "name": "The Westminster Palace",
    "city": "London",
    "country": "United Kingdom",
    "star_rating": "5",
    "price_per_night_usd": "380.00",
    "amenities": "WiFi,Pool,Spa,Restaurant,Concierge",
    "available_rooms": "6",
    "check_in_date": "2025-09-01",
    "check_out_date": "2025-09-15"
  },
  {
    "hotel_id": "CT-HT-005",
    "name": "Camden Town Hostel",
    "city": "London",
    "country": "United Kingdom",
    "star_rating": "2",
    "price_per_night_usd": "65.00",
    "amenities": "WiFi,Shared Kitchen",
    "available_rooms": "30",
    "check_in_date": "2025-09-01",
    "check_out_date": "2025-09-15"
  },
  {
    "hotel_id": "CT-HT-006",
    "name": "Kensington Gardens Hotel",
    "city": "London",
    "country": "United Kingdom",
    "star_rating": "4",
    "price_per_night_usd": "245.00",
    "amenities": "WiFi,Restaurant,Gym,Parking",
    "available_rooms": "11",
    "check_in_date": "2025-09-01",
    "check_out_date": "2025-09-15"
  },
  {
    "hotel_id": "CT-HT-007",
    "name": "Shibuya Sky Tower Hotel",
    "city": "Tokyo",
    "country": "Japan",
    "star_rating": "5",
    "price_per_night_usd": "290.00",
    "amenities": "WiFi,Pool,Spa,Restaurant,Rooftop Bar",
    "available_rooms": "10",
    "check_in_date": "2025-10-05",
    "check_out_date": "2025-10-20"
  },
  {
    "hotel_id": "CT-HT-008",
    "name": "Asakusa Traditional Ryokan",
    "city": "Tokyo",
    "country": "Japan",
    "star_rating": "4",
    "price_per_night_usd": "180.00",
    "amenities": "WiFi,Hot Spring,Traditional Breakfast,Garden",
    "available_rooms": "5",
    "check_in_date": "2025-10-05",
    "check_out_date": "2025-10-20"
  },
  {
    "hotel_id": "CT-HT-009",
    "name": "Shinjuku Business Hotel",
    "city": "Tokyo",
    "country": "Japan",
    "star_rating": "3",
    "price_per_night_usd": "110.00",
    "amenities": "WiFi,Breakfast,Laundry",
    "available_rooms": "25",
    "check_in_date": "2025-10-05",
    "check_out_date": "2025-10-20"
  },
  {
    "hotel_id": "CT-HT-010",
    "name": "Roma Colosseum View",
    "city": "Rome",
    "country": "Italy",
    "star_rating": "4",
    "price_per_night_usd": "230.00",
    "amenities": "WiFi,Restaurant,Rooftop Terrace,Breakfast",
    "available_rooms": "12",
    "check_in_date": "2025-11-01",
    "check_out_date": "2025-11-15"
  },
  {
    "hotel_id": "CT-HT-011",
    "name": "Trastevere Boutique B&B",
    "city": "Rome",
    "country": "Italy",
    "star_rating": "3",
    "price_per_night_usd": "125.00",
    "amenities": "WiFi,Breakfast,Garden",
    "available_rooms": "9",
    "check_in_date": "2025-11-01",
    "check_out_date": "2025-11-15"
  },
  {
    "hotel_id": "CT-HT-012",
    "name": "Vatican Luxury Residence",
    "city": "Rome",
    "country": "Italy",
    "star_rating": "5",
    "price_per_night_usd": "410.00",
    "amenities": "WiFi,Pool,Spa,Restaurant,Concierge,Gym",
    "available_rooms": "4",
    "check_in_date": "2025-11-01",
    "check_out_date": "2025-11-15"
  },
  {
    "hotel_id": "CT-HT-013",
    "name": "Canc\u00fan Beachfront Resort",
    "city": "Canc\u00fan",
    "country": "Mexico",
    "star_rating": "5",
    "price_per_night_usd": "350.00",
    "amenities": "WiFi,Pool,Beach Access,Spa,All-Inclusive,Kids Club",
    "available_rooms": "20",
    "check_in_date": "2025-12-20",
    "check_out_date": "2026-01-05"
  },
  {
    "hotel_id": "CT-HT-014",
    "name": "Playa Del Sol Hotel",
    "city": "Canc\u00fan",
    "country": "Mexico",
    "star_rating": "4",
    "price_per_night_usd": "195.00",
    "amenities": "WiFi,Pool,Beach Access,Restaurant",
    "available_rooms": "16",
    "check_in_date": "2025-12-20",
    "check_out_date": "2026-01-05"
  },
  {
    "hotel_id": "CT-HT-015",
    "name": "Centro Canc\u00fan Budget Stay",
    "city": "Canc\u00fan",
    "country": "Mexico",
    "star_rating": "2",
    "price_per_night_usd": "72.00",
    "amenities": "WiFi,Breakfast,Parking",
    "available_rooms": "35",
    "check_in_date": "2025-12-20",
    "check_out_date": "2026-01-05"
  }
]
